{
  "schema_version": "1.0.0",
  "report_id": "fresh_bananas-canonical-report-example",
  "analysis_id": "fresh_bananas-example",
  "generated_at": "2026-09-09T18:30:00Z",
  "evidence_observed_at": "2026-08-07T05:16:43Z",
  "benchmark_retailer": {
    "id": "walmart_us",
    "name": "Walmart (US)"
  },
  "competitors": [
    {
      "id": "aldi_us",
      "name": "ALDI (US)"
    }
  ],
  "product_pack": {
    "id": "fresh_bananas",
    "name": "Fresh Bananas & Plantains",
    "version": "1.0.0",
    "checksum": null
  },
  "retailer_packs": [
    {
      "retailer_id": "walmart_us",
      "version": "1.0.0",
      "checksum": "bbbbbbbbbbbbbbbbbbbbbbbbbbbbbbbbbbbbbbbbbbbbbbbbbbbbbbbbbbbbbbbb"
    },
    {
      "retailer_id": "aldi_us",
      "version": "1.0.0",
      "checksum": "cccccccccccccccccccccccccccccccccccccccccccccccccccccccccccccccc"
    }
  ],
  "contracts": {
    "distribution": {
      "version": "1.0.0",
      "basis": "positive_price_store_search_result",
      "grain": "retailer_product_id_x_store_id",
      "deduplication": "distinct_store_id_per_product",
      "price_rule": "price_gt_zero",
      "inventory_claim": false,
      "stock_status_used": false,
      "sponsorship_used": false,
      "extrapolation": false
    },
    "service_area_presence": {
      "version": "1.0.0",
      "basis": "positive_price_service_area_search_result",
      "grain": "retailer_product_id_x_service_area",
      "price_rule": "price_gt_zero",
      "presented_as_store_count": false
    }
  },
  "readiness": {
    "status": "ready_with_caveats",
    "blocking_reasons": [],
    "warnings": [
      {
        "code": "example_fixture",
        "message": "This is a contract fixture, not a production report.",
        "next_action": null
      }
    ]
  },
  "seller_governance": {
    "status": "passed",
    "benchmark_requirement": "qualified_seller_or_not_applicable",
    "unverified_product_count": 0,
    "excluded_product_count": 1
  },
  "price_normalization": {
    "status": "passed_with_exclusions",
    "unit_basis": "each",
    "zero_price_sentinel_rule": "zero_regular_or_discounted_price_is_missing",
    "invalid_price_record_count": 1
  },
  "summary": {
    "relationship_count": 1,
    "walmart_win_count": 1,
    "competitor_win_count": 0,
    "parity_count": 0,
    "unscored_count": 0,
    "excluded_relationship_count": 2
  },
  "product_relationships": [
    {
      "relationship_id": "walmart_us:44390948|aldi_us:banana-each",
      "benchmark_product": {
        "retailer_id": "walmart_us",
        "retailer_product_id": "44390948",
        "title": "Fresh Banana, Each",
        "url": "https://www.walmart.com/ip/44390948",
        "image_url": "https://i5.walmartimages.com/example-banana.jpeg",
        "brand": null,
        "brand_type": "unclassified",
        "seller_status": "qualified",
        "package": {
          "label": "each",
          "unit_basis": "each",
          "quantity": 1,
          "unit": "each"
        },
        "price": {
          "reporting_price": 0.2,
          "reporting_price_label": "$0.20/each",
          "package_price": 0.2,
          "normalized_unit_price": null,
          "regular_price": 0.2,
          "discounted_price": null,
          "currency": "USD"
        },
        "distribution": {
          "physical_store_distribution_count": 4294,
          "service_area_presence_count": 0,
          "searched_store_count": 4683
        }
      },
      "competitor_product": {
        "retailer_id": "aldi_us",
        "retailer_product_id": "banana-each",
        "title": "Banana, Each",
        "url": "https://www.aldi.us/store/aldi/products/banana-each",
        "image_url": "https://www.aldi.us/example-banana.jpeg",
        "brand": null,
        "brand_type": "unclassified",
        "seller_status": "not_applicable",
        "package": {
          "label": "each",
          "unit_basis": "each",
          "quantity": 1,
          "unit": "each"
        },
        "price": {
          "reporting_price": 0.27,
          "reporting_price_label": "$0.27/each",
          "package_price": 0.27,
          "normalized_unit_price": null,
          "regular_price": 0.27,
          "discounted_price": null,
          "currency": "USD"
        },
        "distribution": {
          "physical_store_distribution_count": 2100,
          "service_area_presence_count": 0,
          "searched_store_count": 2687
        }
      },
      "comparison": {
        "comparison_basis": "spec_equivalent",
        "unit_basis": "each",
        "price_delta": -0.07,
        "price_delta_percent": -0.2592592593,
        "outcome": "walmart_wins",
        "match_certification": {
          "status": "certified_comparable",
          "source": "matching_v2_gold_set"
        }
      },
      "evidence_refs": [
        {
          "kind": "search_observation",
          "id": "walmart_us:44390948:store:1753"
        },
        {
          "kind": "match_decision",
          "id": "fresh_bananas-gold-set:44390948:aldi_us:banana-each"
        }
      ]
    }
  ],
  "excluded_relationships": [
    {
      "relationship_id": "walmart_us:third-party-example|aldi_us:banana-each",
      "benchmark_product_id": "third-party-example",
      "competitor_product_id": "banana-each",
      "competitor_retailer_id": "aldi_us",
      "reason_code": "benchmark_seller_not_qualified",
      "reason": "Benchmark product is not seller-qualified for Walmart reporting.",
      "evidence_refs": []
    },
    {
      "relationship_id": "walmart_us:zero-price-example|aldi_us:banana-each",
      "benchmark_product_id": "zero-price-example",
      "competitor_product_id": "banana-each",
      "competitor_retailer_id": "aldi_us",
      "reason_code": "invalid_zero_price",
      "reason": "A zero regular or discounted price sentinel was treated as missing and excluded from reportable price claims.",
      "evidence_refs": []
    }
  ],
  "qa": {
    "included_relationship_count": 1,
    "excluded_relationship_count": 2,
    "invalid_price_record_count": 1,
    "unverified_seller_product_count": 0,
    "products_without_image_count": 0,
    "products_without_valid_distribution_count": 0,
    "match_certification_complete": true,
    "product_pack_coverage_status": "passed",
    "retailer_coverage_status": "passed_with_exclusions"
  }
}
